,Date,Media,Title,Article,Authenticity
0,0 mins ago,Deccan Chronicle,PM Modi to virtually flag off Vande Bharat train between Secunderabad-Vizag on Sunday,vande bharat express secunderabad vizag flag virtually prime minister narendra modi january park secunderabad railway station heavy security dc imagegandhi hyderabad prime minister narendra modi would virtually flag vande bharat train secunderabad port city visakhapatnam andhra pradesh auspicious occasion makar sankranti sunday union railway minister ashwini vaishnaw union tourism culture minister g kishan reddy telangana governor tamilisai soundararajan would physically present secunderabad railway station inauguration regular service train would start january booking commence saturday railway source say visakhapatnamsecunderabad vande bharat express start would reach secunderabad pm secunderabadvisakhapatnam train start secunderabad pm would reach visakhapatnam pm train stop rajahmundry vijayawada khammam warangal direction south central railway scr release say train comprise ac chair car coaches two executive ac chair car coaches capacity passenger provide fast travel facility two station exclusive reserve sit accommodation say train manufacture indigenous technology equip modern feature enhance comfort train automatic sliding door provide recline seat class rotate seat executive class release say,Real
1,2 hours ago,Business Standard,"PM Modi, EAM Jaishankar extend warm wishes on occasion on Bhogi",prime minister saturday extend greeting occasion bhogi best wish bhogi praying everyone happiness wellbeing pm modi tweet external affairs minister dr bjp president jp nadda extend hearty wish occasion bhogi warm greetings harvest festival makar sankranti magh bihu pongal uttarayan may bring joy prosperity good health everyone external affairs minister say bhogi celebrate first day fourday pongal festival one prominent harvest festival country primarily celebrate telangana andhra pradesh tamil nadu karnataka honour lord indra god rain cloud farmers worship lord indra day also know indran seek blessing good rain bountiful harvest prosperity headline picture report may rework business standard staff rest content autogenerated syndicate feed,Real
2,7 mins ago,The Week,Voice of the Global South Summit: India aims for larger say in global order,attempt balance west eye north india hop rally ‘ south ’ theme twoday virtual voice global south summit “ unity voice unity purpose ” india ’ attempt add another note chorus global order “ india always stand great role develop country determine common future ” prime minister narendra modi say opening statement summit “ century global growth come country south ” modi stress “ humancentric globalisation ’ ’ address “ develop country concern increase fragmentation international landscape say country include africa seven europe latin america caribbean region summit dub success press conference post summit foreign secretary vinay mohan kwatra say “ one thing come across clearly summit need articulate voice global south international institution reform balanced representation develop world ” china invite statement chinese foreign office say india inform beijing consideration plan “ greatly value solidarity cooperation common development develop country ’ ’ chinese foreign ministry statement say asked india inform china summit kwatra choose word carefully say india “ robust cooperation ” member postpandemic world rock conflict ukraine energy food security challenge developing world “ turn page another difficult year saw war conflict terrorism geopolitical tension rise food fertiliser fuel price climatechange driven natural disaster lasting economic impact pandemic ” say beyond turbulence world special summit also come time india president determine strong voice shape world country kwatra say want india carry voice responding question whether forum go big movement non aligned movement kwatra say platform objective practice process membership “ summit dilute way india engage proactively robustly forum whether non aligned movement give current global context felt important u shape platform capture voice global south purposeful meaningful way carry forward international institution include ” say,Fake
3,2 mins ago,India TV News,"Opinion | Ganga river cruise can be a blessing for Bihar, UP, Bengal, Assam",follow u image source india tv aaj ki baat rajat sharma prime minister narendra modi friday flag world long km long river cruise maiden voyage mv ganga vilas cruise german swiss tourist leave varanasi reach dibrugarh assam via bangladesh day modi hop new era cruise tourism would create job opportunity selfemployment say inland waterway develop promote cruise tourism india modi say witness level infrastructure unimaginable year ago also inaugurate rs crore worth project waterway development bihar west bengal assam also open tent city project varanasi cost ganga vilas travel cruise minimum rs lakh per head could go rs lakh per passenger trip vegetarian food serve alcohol allow spa salon gym facility available trip cover nearly tourist destination include world heritage site river bank national park city like patna dhaka kolkata guwahati pm flag cruise several opposition party oppose say would cause job loss fisherman boatman ply river ganga samajwadi party chief akhilesh yadav query happen boatman boat congress describe cruise useless jdu chief lallan singh say state government bihar allow plying good waterway describe cruise waste money modi speech describe river ganga mother india lifeline point migration labourer city locate near ganga due lack job opportunity modi say cruise varanasi new tent city give boost tourism job opportunity samajwadi party chief akhilesh yadav claim present bjp government renovate launch boat purchase rule present new boat launch say modi promise clean river ganga fulfil congress leader jairam ramesh ask modi happen namami gange project ganga river still dirty stag drama like cruise tent city say uttar pradesh chief minister yogi adityanath say government provide cng boat replaced dieselrun boat order stop pollution ganga say landlocked state since seashore nearby product make small town state fail reach foreign shore due lack infrastructure ganga river cruise small artisan benefit sell product international market add fact neither congress samajwadi party ever think ply ganga river cruise modi original idea implement also true luxury cruise create much impact state economy give boost inland waterway link city entire town flourish incoming tourist since work launch modi opposition party bind object boatmen mallah form large vote bank live bank river ganga akhilesh yadav allege cruise gobble job boatman yogi say cruise boon gangaputra child ganga akhilesh yadav know foreign tourist single trip six trip year mean total foreign tourist travel cruise hand lakh tourist visit benares every year cruise gobble job boatman akhilesh learn bihar deputy cm tejashwi yadav welcome cruise say blessing boatman enhance job opportunity improve economy town locate bank ganga foreign tourist know great heritage bihar visit famous historic site tejashwi speak deputy chief minister event speak manner befit position janata dal u chief lallan singh alliance partner speak cruise lallan singh try hard project leader nitish kumar prime ministerial candidate naturally suppose support modi think matter relate development politician rise politics aaj ki baat monday friday pm india number one followed super prime time news show aaj ki baat rajat sharma ke saath launch general elections since inception show redefine india superprime time numerically far ahead contemporary latest india news,Real
4,2 hours ago,Hindustan Times,‘Pained…’: PM Modi after demise of Congress MP who died during Bharat Jodo Yatra,prime minister narendra modi saturday express grief demise congress mp santokh singh chaudhary die follow cardiac arrest bharat jodo yatra punjab saturday morning pm modi say “ remember effort serve people punjab ” “ pained pass away mp shri santokh singh chaudhary ji remember effort serve people punjab condolences family supporter om shanti ” pm modi write tweet pained pass away mp shri santokh singh chaudhary ji remember effort serve people punjab condolences family supporter om shanti — narendra modi narendramodi january according leader opposition punjab assembly partap singh bajwa santokh singh join gandhiled yatra phillaur walk along another mp kerala suddenly collapse rush phagwara civil hospital ambulance declare brought dead last rite perform village sunday also read video congress mp walk rahul gandhi die yatra meanwhile congress mp rahul gandhi visit residence late mp jalandhar offer condolence aggrieve family yatra also suspend hour several leader also condole congress mp demise also read strong pillar congress rahul tribute mp die bharat jodo punjab chief minister bhagwant mann tweet punjabi “ deeply sadden untimely death congress member parliament jalandhar santokh singh chowdhury may god rest soul peace ” delhi chief minister arvind kejriwal say “ saddened hear sudden passing away lok sabha mp jalandhar shri santokh chaudhary ji condolence family may soul rest peace om shanti,Real
5,1 hour ago,Mint,'Pariksha pe Charcha' annual expenditure increased 65% from 2019 to 2022: Report,prime minister narendra modi conduct pariksha pe charcha become ₹ crore event accord late data make available ministry education right information rti application available data suggest spending pariksha pe charcha event double since central government spend ₹ crore pariksha pe charcha part large movement narendra modiled initiative ‘ exam warriors ’ event prime minister india interacts student teacher parent across country share valuable tip take board entrance exam relaxed stress free manner according data ministry education note amount spend hold pariksha pe charcha event high average amount spend maintain government run kendriya vidyalaya kv jawahar navodaya vidyalaya jnv year note kendriya vidyalaya jawahar navodaya vidyalaya receive fund directly central government pariksha pe charcha brainchild prime minister narendra modi hold annually since ahead central board secondary education cbse board examination education ministry reply rti mention pariksha pe charcha event wherein student parent teacher meet prime minister “ discus overcome stress emerge examination order celebrate life utsav edition pariksha pe charcha schedule hold january talkatora indoor stadium new delhi point report careers data provide education ministry show whopping increase central government expenditure expenditure data include spending event include advertisement publicity accommodation ppc kit booking talkatora stadium according report publish careers see central government likely average spends least little ₹ crore year kv jnv however report also show government spend approximate ₹ crore annual pariksha pe charcha event “ expenditure incur ppc average cost run kv jnv corresponding year mark careers report pariksha pe charcha education minister dharmendra pradhan december review ongoing preparation ppc event call deepening expand engagement student parent teacher ppc ministry extend registration pariksha pe charcha till january event total student teacher parent select competition mygov gift ppc kits certificate appreciation director national council educational research development ncert,Fake
6,2 hours ago,Medical Dialogues,"Make India Tobacco-free: FAIMA writes to PM Modi, seeks immediate action",new delhi taking cognizance adverse effect tobacco federation india medical association faima submit letter prime minister narendra modi urge take immediate step make country free burden tobacco controlling tobacco use primordial prevention especially come young population save many million life faima request kindly look matter early possible take immediate step help country become tobaccofree read letter also read health ministry launch report tobacco free film television policy commenting issue deepak kumar vice president faima tell medical dialogues longterm use tobacco increase risk die stroke heart disease core medical fraternity faima member initiate make india tobacco free campaign add hard leave tobacco answer may yes certainly impossible initiative may small impact make definitive even one day tobacco elimination increase life expectancy day doctor association say letter tobacco use one big public health threat country cause almost loses life every year lead loss life also heavy social economic cost public faima also launch campaign educate people ill effect tobacco pointing india second large producer consumer tobacco association far state letter prevalent form tobacco use india smokeless tobacco khaini gutkha paan zarda smoke form tobacco bidi cigarette hookah request control use tobacco every form save population remove public health threat tobaccofree india campaign try make public aware illeffects tobacco initially launch campaign every medical college country later expand public domain say ajay kumar singh national president faima taking plan faima handle issue excessive tobacco consumption another member faima dr manish state start public domain get successful hospitals india take help judiciary bureaucracy politician help,Fake
7,2 hours ago,India TV News,"Bihar: Controversy erupts over RJD poster depicting Nitish Kumar as 'Ram', PM Modi as 'Ravana'",follow u image source india tv bihar controversy erupts rjd poster depict nitish kumar ram pm modi ravana bihar poster controversy fresh controversy erupt poster see outside rashtriya janata dal rjd office bihar capital patna poster put outside former bihar chief minister rjd leader rabri devi residence depict prime minister narendra modi raavankansa controversy snowball two hindu mythology ramayana mahabharata use interpret bharatiya janata party bjp loss victory grand alliance lok sabha election poster depict nitish ram pm modi ravana poster also depict bihar incumbent chief minister nitish kumar lord ramakrishna prime minister narendra modi raavankansa poster divide two row illustrate lord ram defeat ravana ramayana lord krishna defeat kansa mahabharata low portion poster also claim mahagathbandhan leadership nitish kumar defeat pm modiled bjp general election nitish kumarled jd u ditch bjp mention nitish kumarled jd u august ditch bjp join mahagathbandhan grand alliance rjd congress left according report nitish unhappy bjp since lok sabha election party offer single berth narendra modiled cabinet centre also read speak truth stand bihar education minister row ramcharitmanas remark latest india news,Fake
8,1 hour ago,Udayavani,Kalaburagi: Modi to visit on Jan 19; Preparations underway,kalaburagi modi visit jan preparations underway team udayavani jan pm ist kalaburagi preparations underway prime minister narendra modi ’ visit kalaburagi january visit modi distribute property document resident ‘ tandas ’ makeshift house scsts village mega event malkhed first time history karnataka document distribute tanda resident beneficiary choose hyderabadkarnataka region district raichur bidar yadgir vijayapura accord revenue department official state minister revenue r ashoka hold series meeting official kalaburagi make impactful event huge helipad construct event cook depute cook food counter open day event beneficiary bring bus accord minister kalaburagi home turf aicc president mallikarjuna kharge defeat last parliamentary election want prove might upcoming state assembly poll karnataka ’ rule bjp want defeat plan kalaburagi entire northern region state ians input,Real
