,Date,Media,Title,Article,Authenticity
15,1 hour ago,OpIndia,Human Rights Watch repeats familiar lies about India made by left-liberals and Islamists,yet another international organisation come report allege narendra modi government india discriminate minority stifle dissent suppress free speech recently release word report human rights watch selfproclaimed defender human right make comment ask western powers shift supply chain china india report author activist tirana hassan executive director human rights watch earlier associate amnesty international several organisation antiindia comment make human rights watch section china title ‘ brighter spotlight beijing ’ talk detail authoritative regime xi jinping include atrocity uyghur muslims xinjiang region report note increase global focus dismal human right situation china include discussion matter united nations however report say due increase discomfort around chinese government ’ repressive ambition several government start expand trade relation india human rights watch warn government hrw say several government include australia japan canada uk eu us look cultivate trade security alliance india “ take cover behind brand “ world ’ large democracy ” ” advise government claim narendra modiled bjp government “ mimic many abuse enable chinese state repression—systematic discrimination religious minority stifle peaceful dissent use technology suppress free expression—to tighten grip power ” report allege world leader make careless tradeoff human right accuse justify cost business hrw alleges world leader ignore “ longerterm implication compromise ” far claim “ deepening tie modi government avoid trouble right record squanders valuable leverage protect precious increasingly endanger civic space india ’ democracy relies ” elsewhere report hrw criticise biden administration allegedly temper “ criticism abuse increase authoritarianism india thailand philippines elsewhere region security economic reason instead recognize linked ” report india hrw write become familiar rant leftliberal organisation modi government bjp government continue “ systematic discrimination stigmatization religious minority particularly muslims ” allege attack freedom speech govt take action ngos violate various norm include foreign funding norm action people accuse link terror group allegation hrw india familiar one baseless ever since modi government come power islamists leftliberals spread propaganda muslims oppress even reform measure like ban triple talaq cite attack muslims citing couple random criminal incident victim muslims islamistleftliberal ecosystem able create propaganda muslims oppress india group like human rights watch propaganda fact ecosystem catch use lie attack modi govt like called “ use technology suppress free expression ” mention hrw report although mention clear refer allegation bjp use app name tek fog manipulate social medium bjp special access social medium platform give unlimited power manipulate content allegation make leftist propaganda outlet wire prove false outlet take tek fog meta story fact prevent human rights watch allege modi government use technology supress free speech similarly hrw also mention pegasus ignore fact probe find evidence use indian citizen government indian medium social medium fill islamists leftliberals continue attack modi government daily often fake allegation hrw allege oppression free speech hrw mention several kashmiri hindus minority like sikhs kill terror attack kashmir recent time fail mention kill religious ideology behind attack instead group criticise government action ‘ journalist ’ link terrorist report claim journalist include sajad gul fahad shah arrest report public protest ‘ contradictory claim ’ security force complete lie sajad gul associate journalist turn terrorist mukhtar baba involve attack journalist region hand fahad shah spread antiindia propaganda social medium instigate terror attack journalist arrest report hrw report claim like report group hrw also fail mention md zubair alt news arrest cite example crackdown dissent free speech fail mention zubair cause several death widespread riot india ’ think former bjp leader nupur sharma right free speech talk prophet mohammed even fact mention islamic text report mention incident slam police action islamist rioter nupur sharma mention islamists kill multiple people support nupur sharma online criticise police instead control riot demand beheading nupur sharma hrw also resort lie target india photo caption main report say ‘ hijabwearing student arrive attend class policewoman stand guard outside government school recent hijab ban udupi town southern state karnataka india ’ text give impression ban hijab karnataka completely false hijab ban school uniform norm never ban hijab outside school india report mention fact still criticise move ignore fact hijab nothing attack human right muslim woman,Fake
16,LIVE1 hour ago,The Indian Express,Chennai News Live Updates: City wakes up to thick layer of smog after Bhogi celebrations,sethusamudram project would benefit dmk leader bjp tn chief annamalai bjp tamil nadu unit chief annamalai friday say sethusamudram waterway project straddle india sri lanka would benefit shipping company leader ruling dmk bjp leader post series tweet hit chief minister mk stalin voice opposition sethusamudram project opposition bjp well hindu seer express concern waterway project claim cause harm ram setu bridge posting detail press brief earlier day annamalai take twitter say bjp conduct press meeting clarify people tamil nadu cmotamilnadu mislead assembly halftruths lie sethu samudram project accepting resolution misconstrue acceptance alignment bjp state categorically let project proceed alignment destruction ram setu allow execution project annamalai post add factfinding team commission prime minister narendra modi study feasibility project yet make submission ram setu ani targeting cm mk stalin bjp state unit chief say latter ignore tsunami expert advice continue project cmotamilnadu also ignore advice tsunami expert prof tad murthy say destruction ram setu could cause tsunami region annamalai say add former cm j jayalalithaa also point sethusamudram canal handle large cargo shipment also sethusamudram project might benefit shipping company dmk leader tr baalu kanimozhi annamalai say tweet earlier thursday stalin adopt resolution assembly sethusamudram project,Real
17,2 hours ago,India Today,Pained by the loss: PM Modi condoles demise of Congress MP Santokh Singh during Bharat Jodo Yatra,pained pass away mp shri santokh singh chaudhary ji write pm modi tweet india today web desk prime minister narendra modi saturday express condolence demise congress leader mp santokh singh chaudhary die heart attack attend bharat jodo yarata punjab ludhiana “ pained pass away mp shri santokh singh chaudhary ji remember effort serve people punjab condolences family supporter om shanti ” prime minister write tweet read congress leader take phagwara ’ virk hospital declare brought dead rahul gandhi pause yatra reach hospital receive news yatra suspend day punjab congress chief say yatra suspend tomorrow sunday last rite congress mp santokh singh hold tomorrow “ yatra suspend today tomorrow last rite hold nt speak rahul gandhi yet feel last rites start yatra till last rites suspend ” say punjab congress chief meanwhile bharat jodo yatra commence september last year kanyakumari culminate january jammu kashmir srinagar also read nitish kumar ram pm modi ravana posters outside patna rjd office spark row,Real
18,2 hours ago,BW Disrupt,India s First CoE In Online Gaming Will Come Up In Shillong By March 2023,centre excellence coe set digital india startup hub software technology parks india minister state electronics information technology rajeev chandrasekhar friday announce first centre excellence coe online gaming come shillong meghalaya coe set digital india startup hub software technology parks india minister say coe set march statement centre say expect coe shillong catalyse startup entrepreneur entire north east region build next gen online gaming ecosystem “ vision pm shri narendra modi ji next wave startup entrepreneur must come shillong kohima part north east india ” say rajeev chandrasekhar interact journalist press conference shillong ministry electronics meity recently circulate draft amendment rules relation online gaming public consultation,Fake
19,2 hours ago,India TV News,"Bihar: Controversy erupts over RJD poster depicting Nitish Kumar as 'Ram', PM Modi as 'Ravana'",follow u image source india tv bihar controversy erupts rjd poster depict nitish kumar ram pm modi ravana bihar poster controversy fresh controversy erupt poster see outside rashtriya janata dal rjd office bihar capital patna poster put outside former bihar chief minister rjd leader rabri devi residence depict prime minister narendra modi raavankansa controversy snowball two hindu mythology ramayana mahabharata use interpret bharatiya janata party bjp loss victory grand alliance lok sabha election poster depict nitish ram pm modi ravana poster also depict bihar incumbent chief minister nitish kumar lord ramakrishna prime minister narendra modi raavankansa poster divide two row illustrate lord ram defeat ravana ramayana lord krishna defeat kansa mahabharata low portion poster also claim mahagathbandhan leadership nitish kumar defeat pm modiled bjp general election nitish kumarled jd u ditch bjp mention nitish kumarled jd u august ditch bjp join mahagathbandhan grand alliance rjd congress left according report nitish unhappy bjp since lok sabha election party offer single berth narendra modiled cabinet centre also read speak truth stand bihar education minister row ramcharitmanas remark latest india news,Fake
20,0 mins ago,India TV News,PM Modi to virtually flag off 'Vande Bharat Express train' between Secunderabad-Visakhapatnam tomorrow,follow u image source pti representational file pm modi virtually flag vande bharat express train secunderabadvisakhapatnam january vande bharat express train prime minister narendra modi flag vande bharat express train connect secunderabad visakhapatnam sunday january around via video conferencing official statement pmo say eighth vande bharat express train introduce indian railways regular service train would start january booking commence saturday railway source say union railway minister ashwini vaishnaw union tourism culture minister g kishan reddy telangana governor tamilisai soundararajan would physically present secunderabad railway station inauguration know features vande bharat express train first one connect teluguspeaking state telangana andhra pradesh cover distance around km add statement train stoppage visakhapatnam rajahmundry vijayawada station andhra pradesh khammam warangal secunderabad station telangana indigenously design train set vande bharat express equip stateoftheart passenger amenity provide rail user fast comfortable convenient travel experience visakhapatnam–secunderabad vande bharat express start would reach secunderabad pm secunderabad–visakhapatnam train start secunderabad pm would reach visakhapatnam pm train stop rajahmundry vijayawada khammam warangal direction south central railway scr release say train comprise ac chair car coaches two executive ac chair car coaches capacity passenger provide fast travel facility two station exclusive reserve sit accommodation say train manufacture indigenous technology equip modern feature enhance comfort train automatic sliding door provide recline seat class rotate seat executive class release say also read pm modi hold meet economist niti aayog ahead union budget latest india news,Real
21,1 hour ago,OpIndia,Human Rights Watch repeats familiar lies about India made by left-liberals and Islamists,yet another international organisation come report allege narendra modi government india discriminate minority stifle dissent suppress free speech recently release word report human rights watch selfproclaimed defender human right make comment ask western powers shift supply chain china india report author activist tirana hassan executive director human rights watch earlier associate amnesty international several organisation antiindia comment make human rights watch section china title ‘ brighter spotlight beijing ’ talk detail authoritative regime xi jinping include atrocity uyghur muslims xinjiang region report note increase global focus dismal human right situation china include discussion matter united nations however report say due increase discomfort around chinese government ’ repressive ambition several government start expand trade relation india human rights watch warn government hrw say several government include australia japan canada uk eu us look cultivate trade security alliance india “ take cover behind brand “ world ’ large democracy ” ” advise government claim narendra modiled bjp government “ mimic many abuse enable chinese state repression—systematic discrimination religious minority stifle peaceful dissent use technology suppress free expression—to tighten grip power ” report allege world leader make careless tradeoff human right accuse justify cost business hrw alleges world leader ignore “ longerterm implication compromise ” far claim “ deepening tie modi government avoid trouble right record squanders valuable leverage protect precious increasingly endanger civic space india ’ democracy relies ” elsewhere report hrw criticise biden administration allegedly temper “ criticism abuse increase authoritarianism india thailand philippines elsewhere region security economic reason instead recognize linked ” report india hrw write become familiar rant leftliberal organisation modi government bjp government continue “ systematic discrimination stigmatization religious minority particularly muslims ” allege attack freedom speech govt take action ngos violate various norm include foreign funding norm action people accuse link terror group allegation hrw india familiar one baseless ever since modi government come power islamists leftliberals spread propaganda muslims oppress even reform measure like ban triple talaq cite attack muslims citing couple random criminal incident victim muslims islamistleftliberal ecosystem able create propaganda muslims oppress india group like human rights watch propaganda fact ecosystem catch use lie attack modi govt like called “ use technology suppress free expression ” mention hrw report although mention clear refer allegation bjp use app name tek fog manipulate social medium bjp special access social medium platform give unlimited power manipulate content allegation make leftist propaganda outlet wire prove false outlet take tek fog meta story fact prevent human rights watch allege modi government use technology supress free speech similarly hrw also mention pegasus ignore fact probe find evidence use indian citizen government indian medium social medium fill islamists leftliberals continue attack modi government daily often fake allegation hrw allege oppression free speech hrw mention several kashmiri hindus minority like sikhs kill terror attack kashmir recent time fail mention kill religious ideology behind attack instead group criticise government action ‘ journalist ’ link terrorist report claim journalist include sajad gul fahad shah arrest report public protest ‘ contradictory claim ’ security force complete lie sajad gul associate journalist turn terrorist mukhtar baba involve attack journalist region hand fahad shah spread antiindia propaganda social medium instigate terror attack journalist arrest report hrw report claim like report group hrw also fail mention md zubair alt news arrest cite example crackdown dissent free speech fail mention zubair cause several death widespread riot india ’ think former bjp leader nupur sharma right free speech talk prophet mohammed even fact mention islamic text report mention incident slam police action islamist rioter nupur sharma mention islamists kill multiple people support nupur sharma online criticise police instead control riot demand beheading nupur sharma hrw also resort lie target india photo caption main report say ‘ hijabwearing student arrive attend class policewoman stand guard outside government school recent hijab ban udupi town southern state karnataka india ’ text give impression ban hijab karnataka completely false hijab ban school uniform norm never ban hijab outside school india report mention fact still criticise move ignore fact hijab nothing attack human right muslim woman,Fake
22,1 hour ago,ThePrint,Brazil’s top court orders probe of Bolsonaro role in January 8 riots,sao paulo january ani part large campaign hold guilty accountable judge brazilian supreme court approve investigation friday determine whether former president jair bolsonaro spark unrest nation ’ capital january washington post report justice alexandre de moraes grant request prosecutor general ’ office reference video bolsonaro upload facebook two day disturbance video bolsonaro claim luiz inacio lula da silva ’ vote office choose supreme court brazil ’ electoral authority supporter chant support lula ’ narrow victory report washington post currently brazilian authority investigate give bolsonaro ’ extremist follower permission invade supreme court congress presidential residence effort void result election october supporters former brazil president break country ’ congressional building supreme court presidential palace january breach come week inauguration president luiz inacio lula da silva defeat bolsonaro runoff election october videos social medium show bolsonaro supporter smash window furniture national congress supreme court building sunday report al jazeera climb onto roof congress building brazil ’ senate chamber deputies conduct legislative business unfurl banner read ‘ intervention ’ apparent appeal brazil ’ military security force use tear gas effort push back demonstrator local medium estimate people involve incident report al jazeera prime minister narendra modi express deep concern rioting vandalism state institution brasilia extend full support brazilian authority “ deeply concerned news rioting vandalism state institution brasilia democratic tradition must respect everyone extend full support brazilian authority ” tweet pm modi us president joe biden condemn ‘ assault democracy ’ brazil biden tweet “ condemn assault democracy peaceful transfer power brazil brazil ’ democratic institution full support brazilian people must undermine look forward continue work lulaoficial ” un secretarygeneral antonio guterres denounce “ attack brazil ’ democratic institution ” emphasise importance respect democratic institution well brazilian people “ condemn assault brazil ’ democratic institution take place today brazilian people democratic institution must respect full confidence brazil great democratic country ” guterres tweet ani report autogenerated ani news service theprint hold responsibility content,Fake
23,LIVE4 mins ago,Hindustan Times,"'CBI at office, again,' tweets Manish Sisodia amid probe over Delhi excise policy case",welcome hindustantimescom update platform find breaking news india across world find fast update late news break share article,Fake
24,6 mins ago,Hindustan Times,Mamata Banerjee has the ability to be next PM: Amartya Sen,west bengal chief minister mamata banerjee ability next prime minister accord nobel laureate amartya sen also say regional party hold key ruling bjp defeat lok sabha election ability clearly ability hand yet establish mamata pull force public dismay bjp integrated way make possible leadership put end fractionalisation india sen tell pti interview also read ‘ entirely possible bjp lose majority ’ shashi tharoor noted economist however hit bjp accuse ‘ substantially reduce vision india ’ “ bjp narrow understanding india hindu india hindispeaking india strong way would sad alternative bjp country today ” say add saffron party look powerful ‘ good deal ’ weakness also read ‘ advantage modi if… ’ owaisi opposition pm face ls poll per sen regional party important role play “ dmk important party banerjee tmc certainly important samajwadi party stand whether could extend know know enough able dismiss antibjp party together ” congress hand weakened nobel laureate remark though also concede grand old party provide allindia vision also read ‘ ram temple ayodhya ready jan ’ amit shah tripura amartya sen remark come time next general election less month away prime minister narendra modi set run third term opposition yet put united front year many nine state go poll include bjpruled karnataka madhya pradesh congressruled chhattisgarh rajasthan share article,Fake
25,5 mins ago,Times of India,India’s G20 an opportunity for our youth to become global ambassadors like Swami Vivekanand,india one old civilisation one young population perhaps diverse vibrant democracy india ’ current population age year age even global population continue age young demographic profile asset domestically large global context india ’ presidency offer india ’ youth coveted opportunity become ambassador global cause one engagement group youth power youth harness script global consensus issue confronts humanity theme india include future work industry climate change make sustainability way life peacebuilding reconciliation ushering era war shared future youth democracy governance health wellbeing sports india mere start ups prime minister narendra modi ’ leadership india emerge thirdlargest ecosystem startup startup spread across district india merely unicorn rise whopping estimates report suggest number rise apart conducive proease business ecosystem policy environment create modi government also push towards innovation digitalisation use automation technology fuel young entrepreneur india deliver creative solution global problem create successful business model play vital role shape fourth industrial revolution also replicate customise successful business model perspective gain market share also share fruit prosperity growth especially develop nation ideal platform showcase business model expand new territory huge boost start ecosystem india coincides rapid bridging gap india ’ digital divide india whopping crore mobile subscriber smartphone user lakh gram panchayat connect optical fibre internet penetration jump mere even code wireless data fell ₹ per gb data ₹ per gb almost lakh km optical fibre lay rural india possible due enthusiasm demand youth today deploy technology digital tool good governance business consider new normal india especially post covid pandemic another area indian youth play vital role become stakeholder sort modi government combat climate change move towards sustainable clean green future advocacy adaption technology today india emerge global leader renewable energy large clean energy capacity world large instal wind energy capacity large solar instal capacity installed clean energy capacity grow whopping since gw gw pm modi promise india would gw non fossil fuel base energy seem track almost total installed capacity come nonfossil fuel base energy since solar energy instal capacity see rise wind see rise nuclear see increase india pledge achieve netzero emission fact achieve target year ahead schedule add confidence statement intent summit pm modi unveil global mission call life – lifestyle environment emphasise enlist participation youth particular towards adopt simple sustainable living energy conservation something come naturally indians one example distribution led bulb lead save million unit energy given backdrop arm experience indian youth become true climate warrior motivate others participate mission save planet earth presidency come india amritkal year independence also year remember celebrate freedom fighter – mahatma gandhi sardar patel bhagwan birsa munda bhagat singh crusade justice fight oppression imperialist colonial mindset inspire entire world provide become vector agent message proudly repeat clarity ordinarily event huge global import restrict delhi pm modi ’ government take decision broadbase event host meeting location across india next month open plethora avenue every state especially youth participate amplify diverse inclusive unifying message bharat world vasudhaiva kutumbakam university connect programme allow student university across india participate also host cultural program exchange opportunity tourism discussion forum track young entrepreneur think leader showcase history heritage hospitality talent idea tool social medium creativity youth also real time document amplify message learning come exchange year ago young saffron clad swami vivekananda create ripple groundbreaking speech world ’ parliament religions usa today one u invoke vivekanand element inside u become global ambassador facebook twitter linkedin email disclaimer views express author,Fake
